{
  "id": "board-directors",
  "name": "Board Directors",
  "description": "Черновая палата совета директоров для управленческих go/no-go решений.",
  "status": "draft",
  "labels": {
    "company": "совет",
    "companies": "советы",
    "agent": "директор",
    "agents": "директора",
    "task": "решение",
    "tasks": "решения"
  },
  "roles": [
    "roles.json"
  ],
  "presets": [
    "presets/mvp.json"
  ],
  "synthesisRole": "ceo",
  "transparencyPolicy": "source-citation",
  "allowedSkills": [
    "source-citation",
    "web-research",
    "memory-export"
  ],
  "company": {
    "name": "Board Directors",
    "projectName": "Board Decisions",
    "goalTitle": "Run advisory board decision reviews",
    "companyId": null
  }
}
